author_name,title,authors,publication,cited_by_value,year
Michael J. Black,HOLD: Category-agnostic 3D Reconstruction of Interacting Hands and Objects from Video,"Z Fan, M Parelli, ME Kadoglou, M Kocabas, X Chen, MJ Black, O Hilliges","arXiv preprint arXiv:2311.18448, 2023",,2023
Michael J. Black,PoseGPT: Chatting about 3D Human Pose,"Y Feng, J Lin, SK Dwivedi, Y Sun, P Patel, MJ Black","arXiv preprint arXiv:2311.18836, 2023",,2023
Michael J. Black,Parameter-Efficient Orthogonal Finetuning via Butterfly Factorization,"W Liu, Z Qiu, Y Feng, Y Xiu, Y Xue, L Yu, H Feng, Z Liu, J Heo, S Peng, ...","arXiv preprint arXiv:2311.06243, 2023",,2023
Michael J. Black,FLARE: Fast Learning of Animatable and Relightable Mesh Avatars,"S Bharadwaj, Y Zheng, O Hilliges, MJ Black, V Fernandez-Abrevaya","arXiv preprint arXiv:2310.17519, 2023",,2023
Michael J. Black,Ghost on the Shell: An Expressive Representation of General 3D Shapes,"Z Liu, Y Feng, Y Xiu, W Liu, L Paull, MJ Black, B Schölkopf","arXiv preprint arXiv:2310.15168, 2023",,2023
Michael J. Black,PACE: Human and Camera Motion Estimation from in-the-wild Videos,"M Kocabas, Y Yuan, P Molchanov, Y Guo, MJ Black, O Hilliges, J Kautz, ...","arXiv preprint arXiv:2310.13768, 2023",,2023
Michael J. Black,Optimizing the 3D Plate Shape for Proximal Humerus Fractures,"M Keller, M Krall, J Smith, H Clement, AM Kerner, A Gradischar, U Schäfer, ...","International Conference on Medical Image Computing and Computer-Assisted …, 2023",,2023
Michael J. Black,Text-guided generation and editing of compositional 3d avatars,"H Zhang, Y Feng, P Kulits, Y Wen, J Thies, MJ Black","arXiv preprint arXiv:2309.07125, 2023",2,2023
Michael J. Black,Learning disentangled avatars with hybrid 3d representations,"Y Feng, W Liu, T Bolkart, J Yang, M Pollefeys, MJ Black","arXiv preprint arXiv:2309.06441, 2023",2,2023
Michael J. Black,Virtuelle Exposition mit gesundem Gewicht als Behandlungsbaustein für die Anorexia Nervosa,"SC Behrens, J Tesch, P Sun, S Starke, M Black, J Pruccoli, S Zipfel, ...","Adipositas-Ursachen, Folgeerkrankungen, Therapie 17 (03), 142-142, 2023",,2023
Michael J. Black,POCO: 3D Pose and Shape Estimation with Confidence,"SK Dwivedi, C Schmid, H Yi, MJ Black, D Tzionas","arXiv preprint arXiv:2308.12965, 2023",1,2023
Michael J. Black,GRIP: Generating Interaction Poses Using Latent Consistency and Spatial Cues,"O Taheri, Y Zhou, D Tzionas, Y Zhou, D Ceylan, S Pirk, MJ Black","arXiv preprint arXiv:2308.11617, 2023",,2023
Michael J. Black,Tada! text to animatable digital avatars,"T Liao, H Yi, Y Xiu, J Tang, Y Huang, J Thies, MJ Black","arXiv preprint arXiv:2308.10899, 2023",8,2023
Michael J. Black,SCULPT: Shape-Conditioned Unpaired Learning of Pose-dependent Clothed and Textured Human Meshes,"S Sanyal, P Ghosh, J Yang, MJ Black, J Thies, T Bolkart","arXiv preprint arXiv:2308.10638, 2023",,2023
Michael J. Black,SMPL: A skinned multi-person linear model,"M Loper, N Mahmood, J Romero, G Pons-Moll, MJ Black","Seminal Graphics Papers: Pushing the Boundaries, Volume 2, 851-866, 2023",3207,2023
Michael J. Black,Adversarial Likelihood Estimation with One-way Flows,"O Ben-Dov, PS Gupta, V Abrevaya, MJ Black, P Ghosh","arXiv preprint arXiv:2307.09882, 2023",,2023
Michael J. Black,Virtual Reality Exposure to a Healthy Weight Body Is a Promising Adjunct Treatment for Anorexia Nervosa,"SC Behrens, J Tesch, PJB Sun, S Starke, MJ Black, H Schneider, ...","Psychotherapy and Psychosomatics 92 (3), 170-179, 2023",3,2023
Michael J. Black,Generative Proxemics: A Prior for 3D Social Interaction from Images,"L Müller, V Ye, G Pavlakos, M Black, A Kanazawa","arXiv preprint arXiv:2306.09337, 2023",,2023
Michael J. Black,Emotional Speech-Driven Animation with Content-Emotion Disentanglement,"R Daněček, K Chhatre, S Tripathi, Y Wen, MJ Black, T Bolkart","arXiv preprint arXiv:2306.08990, 2023",4,2023
Michael J. Black,AG3D: Learning to Generate 3D Avatars from 2D Image Collections,"A Geiger, O Hilliges, MJ Black, J Yang, X Chen, Z Dong","arXiv, 2023",,2023
Michael J. Black,AG3D: Learning to Generate 3D Avatars from 2D Image Collections,"Z Dong, X Chen, J Yang, MJ Black, O Hilliges, A Geiger","arXiv preprint arXiv:2305.02312, 2023",8,2023
Michael J. Black,TMR: Text-to-Motion Retrieval Using Contrastive 3D Human Motion Synthesis,"M Petrovich, MJ Black, G Varol","arXiv preprint arXiv:2305.00976, 2023",6,2023
Michael J. Black,BARC: Breed-Augmented Regression Using Classification for 3D Dog Reconstruction from Images,"N Rueegg, S Zuffi, K Schindler, MJ Black","International Journal of Computer Vision, 1-16, 2023",,2023
Michael J. Black,Fast-SNARF: A fast deformer for articulated neural fields,"X Chen, T Jiang, J Song, M Rietmann, A Geiger, MJ Black, O Hilliges","IEEE Transactions on Pattern Analysis and Machine Intelligence, 2023",6,2023
Michael J. Black,SINC: Spatial Composition of 3D Human Motions for Simultaneous Action Generation,"N Athanasiou, M Petrovich, MJ Black, G Varol","arXiv preprint arXiv:2304.10417, 2023",1,2023
Michael J. Black,Method and systems for labelling motion-captured points,"MJ Black, N Ghorbani","US Patent App. 17/949,087, 2023",,2023
Michael J. Black,Driven Formation Control of Airships for Cooperative Target Tracking,"E Price, MJ Black, A Ahmad","IEEE Robotics and Automation Letters, 2023",1,2023
Michael J. Black,SmartMocap: Joint Estimation of Human and Camera Motion Using Uncalibrated RGB Cameras,"N Saini, CHP Huang, MJ Black, A Ahmad","IEEE Robotics and Automation Letters, 2023",2,2023
Michael J. Black,Meshdiffusion: Score-based generative 3d mesh modeling,"Z Liu, Y Feng, MJ Black, D Nowrouzezahrai, L Paull, W Liu","arXiv preprint arXiv:2303.08133, 2023",32,2023
Michael J. Black,Synthesizing Physical Character-Scene Interactions,"M Hassan, Y Guo, T Wang, M Black, S Fidler, XB Peng","arXiv preprint arXiv:2302.00883, 2023",11,2023
Michael J. Black,DECO: Dense Estimation of 3D Human-Scene Contact In The Wild,"S Tripathi, A Chatterjee, JC Passy, H Yi, D Tzionas, MJ Black","Proceedings of the IEEE/CVF International Conference on Computer Vision …, 2023",,2023
Michael J. Black,Pairwise Similarity Learning is SimPLE,"Y Wen, W Liu, Y Feng, B Raj, R Singh, A Weller, MJ Black, B Schölkopf","Proceedings of the IEEE/CVF International Conference on Computer Vision …, 2023",,2023
Michael J. Black,ARCTIC: A Dataset for Dexterous Bimanual Hand-Object Manipulation,"Z Fan, O Taheri, D Tzionas, M Kocabas, M Kaufmann, MJ Black, ...","Proceedings of the IEEE/CVF Conference on Computer Vision and Pattern …, 2023",25,2023
Michael J. Black,ECON: Explicit Clothed humans Optimized via Normal integration,"Y Xiu, J Yang, X Cao, D Tzionas, MJ Black","Proceedings of the IEEE/CVF Conference on Computer Vision and Pattern …, 2023",30,2023
Michael J. Black,BITE: Beyond priors for improved three-D dog pose estimation,"N Rüegg, S Tripathi, K Schindler, MJ Black, S Zuffi","Proceedings of the IEEE/CVF Conference on Computer Vision and Pattern …, 2023",6,2023
Michael J. Black,TRACE: 5D temporal regression of avatars with dynamic cameras in 3D environments,"Y Sun, Q Bao, W Liu, T Mei, MJ Black","Proceedings of the IEEE/CVF Conference on Computer Vision and Pattern …, 2023",6,2023
Michael J. Black,Instant Multi-View Head Capture through Learnable Registration,"T Bolkart, T Li, MJ Black","Proceedings of the IEEE/CVF Conference on Computer Vision and Pattern …, 2023",1,2023
Michael J. Black,BEDLAM: A Synthetic Dataset of Bodies Exhibiting Detailed Lifelike Animated Motion,"MJ Black, P Patel, J Tesch, J Yang","Proceedings of the IEEE/CVF Conference on Computer Vision and Pattern …, 2023",9,2023
Michael J. Black,Reconstructing Signing Avatars From Video Using Linguistic Priors,"MP Forte, P Kulits, CHP Huang, V Choutas, D Tzionas, KJ Kuchenbecker, ...","Proceedings of the IEEE/CVF Conference on Computer Vision and Pattern …, 2023",4,2023
Michael J. Black,Generalizing neural human fitting to unseen poses with articulated se (3) equivariance,"H Feng, P Kulits, S Liu, MJ Black, VF Abrevaya","Proceedings of the IEEE/CVF International Conference on Computer Vision …, 2023",1,2023
Michael J. Black,3D human pose estimation via intuitive physics,"S Tripathi, L Müller, CHP Huang, O Taheri, MJ Black, D Tzionas","Proceedings of the IEEE/CVF Conference on Computer Vision and Pattern …, 2023",16,2023
Michael J. Black,Detecting Human-Object Contact in Images,"Y Chen, SK Dwivedi, MJ Black, D Tzionas","Proceedings of the IEEE/CVF Conference on Computer Vision and Pattern …, 2023",2,2023
Michael J. Black,Pointavatar: Deformable point-based head avatars from videos,"Y Zheng, W Yifan, G Wetzstein, MJ Black, O Hilliges","Proceedings of the IEEE/CVF Conference on Computer Vision and Pattern …, 2023",22,2023
Michael J. Black,HOOD: Hierarchical Graphs for Generalized Modelling of Clothing Dynamics,"A Grigorev, MJ Black, O Hilliges","Proceedings of the IEEE/CVF Conference on Computer Vision and Pattern …, 2023",5,2023
Michael J. Black,Generating holistic 3d human motion from speech,"H Yi, H Liang, Y Liu, Q Cao, Y Wen, T Bolkart, D Tao, MJ Black","Proceedings of the IEEE/CVF Conference on Computer Vision and Pattern …, 2023",29,2023
Michael J. Black,MIME: Human-Aware 3D Scene Generation,"H Yi, CHP Huang, S Tripathi, L Hering, J Thies, MJ Black","Proceedings of the IEEE/CVF Conference on Computer Vision and Pattern …, 2023",20,2023
Michael J. Black,Econ: Explicit clothed humans obtained from normals,"Y Xiu, J Yang, X Cao, D Tzionas, MJ Black","arXiv preprint arXiv:2212.07422, 2022",13,2022
Michael J. Black,Capturing and animation of body and clothing from monocular video,"Y Feng, J Yang, M Pollefeys, MJ Black, T Bolkart","SIGGRAPH Asia 2022 Conference Papers, 1-9, 2022",30,2022
Michael J. Black,Parameterized model of 2D articulated human shape,"MJ Black, O Freifeld, AW Weiss, MM Loper, P Guan","US Patent 11,501,508, 2022",,2022
Michael J. Black,Supr: A sparse unified part-based human representation,"AAA Osman, T Bolkart, D Tzionas, MJ Black","European Conference on Computer Vision, 568-585, 2022",14,2022
Michael J. Black,Towards racially unbiased skin tone estimation via scene disambiguation,"H Feng, T Bolkart, J Tesch, MJ Black, V Abrevaya","European Conference on Computer Vision, 72-90, 2022",15,2022
Michael J. Black,TEMOS: Generating diverse human motions from textual descriptions,"M Petrovich, MJ Black, G Varol","European Conference on Computer Vision, 480-497, 2022",116,2022
Michael J. Black,Deep residual reinforcement learning based autonomous blimp control,"YT Liu, E Price, MJ Black, A Ahmad","2022 IEEE/RSJ International Conference on Intelligent Robots and Systems …, 2022",4,2022
Michael J. Black,Machine learning systems and methods for extracting user body shape from behavioral data,"MJ Black, E Rachlin, M Loper, JR Cilley, WJ O'farrell, A Weiss, JL Gelman, ...","US Patent 11,461,630, 2022",,2022
Michael J. Black,gDNA: Towards generative detailed neural avatars,"C Xu, T Jiang, J Song, J Yang, MJ Black, A Geiger, O Hilliges","2022 IEEE/CVF Conference on Computer Vision and Pattern Recognition (CVPR), 2022",1,2022
Michael J. Black,Perception-driven Formation Control of Airships,"E Price, MJ Black, A Ahmad","arXiv preprint arXiv:2209.13040, 2022",1,2022
Michael J. Black,InterCap: Joint Markerless 3D Tracking of Humans and Objects in Interaction,"Y Huang, O Taheri, MJ Black, D Tzionas","DAGM German Conference on Pattern Recognition, 281-299, 2022",16,2022
Michael J. Black,Invgan: invertible gans,"P Ghosh, D Zietlow, MJ Black, LS Davis, X Hu","DAGM German Conference on Pattern Recognition, 3-19, 2022",5,2022
Michael J. Black,Neural Point-based Shape Modeling of Humans in Challenging Clothing,"Q Ma, J Yang, MJ Black, S Tang","2022 International Conference on 3D Vision (3DV), 679-689, 2022",12,2022
Michael J. Black,Teach: Temporal action composition for 3d humans,"N Athanasiou, M Petrovich, MJ Black, G Varol","2022 International Conference on 3D Vision (3DV), 414-423, 2022",42,2022
Michael J. Black,Image generation from 3D model using neural network,"S Prokudin, JR Gonzalez-Nicolas, MJ Black","US Patent 11,403,800, 2022",2,2022
Michael J. Black,iRotate: Active visual SLAM for omnidirectional robots,"E Bonetto, P Goldschmid, M Pabst, MJ Black, A Ahmad","Robotics and Autonomous Systems 154, 104102, 2022",18,2022
Michael J. Black,On Fairness in Face Albedo Estimation,"H Feng, T Bolkart, J Tesch, M Black, V Abrevaya","ACM SIGGRAPH 2022 Talks, 1-2, 2022",2,2022
Michael J. Black,LED: Latent Variable-based Estimation of Density,"O Ben-Dov, PS Gupta, VF Abrevaya, MJ Black, P Ghosh","arXiv preprint arXiv:2206.11563, 2022",,2022
Michael J. Black,Icon: Implicit clothed humans obtained from normals,"Y Xiu, J Yang, D Tzionas, MJ Black","2022 IEEE/CVF Conference on Computer Vision and Pattern Recognition (CVPR …, 2022",146,2022
Michael J. Black,Articulated objects in free-form hand interaction,"Z Fan, O Taheri, D Tzionas, M Kocabas, M Kaufmann, MJ Black, ...","arXiv preprint arXiv:2204.13662, 2022",8,2022
Michael J. Black,Crowdshaping realistic 3D avatars with words,"S Streuber, MAQ RAMÍREZ, M Black, S Zuffi, A O'toole","US Patent 11,282,256, 2022",1,2022
Michael J. Black,LocATe: End-to-end Localization of Actions in 3D with Transformers,"J Sun, B Zhou, MJ Black, A Chandrasekaran","arXiv preprint arXiv:2203.10719, 2022",4,2022
Michael J. Black,Deep Residual Reinforcement Learning based Autonomous Blimp Control,"Y Tang Liu, E Price, MJ Black, A Ahmad","arXiv e-prints, arXiv: 2203.05360, 2022",,2022
Michael J. Black,The neural coding of face and body orientation in occipitotemporal cortex,"C Foster, M Zhao, T Bolkart, MJ Black, A Bartels, I Bülthoff","NeuroImage 246, 118783, 2022",10,2022
Michael J. Black,Airpose: Multi-view fusion network for aerial 3d human pose and shape estimation,"N Saini, E Bonetto, E Price, A Ahmad, MJ Black","IEEE Robotics and Automation Letters 7 (2), 4805-4812, 2022",15,2022
Michael J. Black,Embodied hands: Modeling and capturing hands and bodies together,"J Romero, D Tzionas, MJ Black","arXiv preprint arXiv:2201.02610, 2022",844,2022
Michael J. Black,Capturing and inferring dense full-body human-scene contact,"CHP Huang, H Yi, M Höschle, M Safroshkin, T Alexiadis, S Polikovsky, ...","Proceedings of the IEEE/CVF Conference on Computer Vision and Pattern …, 2022",54,2022
Michael J. Black,Accurate 3D body shape regression using metric and semantic attributes,"V Choutas, L Müller, CHP Huang, S Tang, D Tzionas, MJ Black","Proceedings of the IEEE/CVF Conference on Computer Vision and Pattern …, 2022",30,2022
Michael J. Black,OSSO: Obtaining skeletal shape from outside,"M Keller, S Zuffi, MJ Black, S Pujades","Proceedings of the IEEE/CVF Conference on Computer Vision and Pattern …, 2022",20,2022
Michael J. Black,EMOCA: Emotion driven monocular face capture and animation,"R Daněček, MJ Black, T Bolkart","Proceedings of the IEEE/CVF Conference on Computer Vision and Pattern …, 2022",58,2022
Michael J. Black,Barc: Learning to regress 3d dog shape from images by exploiting breed information,"N Rueegg, S Zuffi, K Schindler, MJ Black","Proceedings of the IEEE/CVF Conference on Computer Vision and Pattern …, 2022",24,2022
Michael J. Black,Human-aware object placement for visual environment reconstruction,"H Yi, CHP Huang, D Tzionas, M Kocabas, M Hassan, S Tang, J Thies, ...","Proceedings of the IEEE/CVF Conference on Computer Vision and Pattern …, 2022",32,2022
Michael J. Black,gdna: Towards generative detailed neural avatars,"X Chen, T Jiang, J Song, J Yang, MJ Black, A Geiger, O Hilliges","Proceedings of the IEEE/CVF Conference on Computer Vision and Pattern …, 2022",45,2022
Michael J. Black,GOAL: Generating 4D whole-body motion for hand-object grasping,"O Taheri, V Choutas, MJ Black, D Tzionas","Proceedings of the IEEE/CVF Conference on Computer Vision and Pattern …, 2022",36,2022
Michael J. Black,Putting people in their place: Monocular regression of 3d people in depth,"Y Sun, W Liu, Q Bao, Y Fu, T Mei, MJ Black","Proceedings of the IEEE/CVF Conference on Computer Vision and Pattern …, 2022",80,2022
Michael J. Black,Im avatar: Implicit morphable head avatars from videos,"Y Zheng, VF Abrevaya, MC Bühler, X Chen, MJ Black, O Hilliges","Proceedings of the IEEE/CVF Conference on Computer Vision and Pattern …, 2022",107,2022
Michael J. Black,Decoding the identity and orientation of faces and bodies,"C Foster, M Zhao, T Bolkart, MJ Black, A Bartels, I Bülthoff",,,2021
Michael J. Black,Learning to disambiguate strongly interacting hands via probabilistic per-pixel part segmentation,"Z Fan, A Spurr, M Kocabas, S Tang, MJ Black, O Hilliges","2021 International Conference on 3D Vision (3DV), 1-10, 2021",32,2021
Michael J. Black,Collaborative regression of expressive bodies using moderation,"Y Feng, V Choutas, T Bolkart, D Tzionas, MJ Black","2021 International Conference on 3D Vision (3DV), 792-804, 2021",75,2021
Michael J. Black,A pose‐independent method for accurate and precise body composition from 3D optical scans,"MC Wong, BK Ng, I Tian, S Sobhiyeh, I Pagano, M Dechenaud, ...","Obesity 29 (11), 1835-1847, 2021",20,2021
Michael J. Black,Autonomous blimp control using deep reinforcement learning,"YT Liu, E Price, P Goldschmid, MJ Black, A Ahmad","arXiv preprint arXiv:2109.10719, 2021",2,2021
Michael J. Black,Skinned multi-infant linear body model,"N Hesse, S Pujades, J Romero, M Black","US Patent 11,127,163, 2021",,2021
Michael J. Black,Autonomous Blimp Control using Deep Reinforcement Learning,"Y Tang Liu, E Price, P Goldschmid, MJ Black, A Ahmad","arXiv e-prints, arXiv: 2109.10719, 2021",,2021
Michael J. Black,Separated and overlapping neural coding of face and body identity,"C Foster, M Zhao, T Bolkart, MJ Black, A Bartels, I Bülthoff","Human Brain Mapping 42 (13), 4242-4260, 2021",9,2021
Michael J. Black,Active visual SLAM with independently rotating camera,"E Bonetto, P Goldschmid, MJ Black, A Ahmad","2021 European Conference on Mobile Robots (ECMR), 1-8, 2021",5,2021
Michael J. Black,Learning an animatable detailed 3D face model from in-the-wild images,"Y Feng, H Feng, MJ Black, T Bolkart","ACM Transactions on Graphics (ToG) 40 (4), 1-13, 2021",312,2021
Michael J. Black,Parameterized model of 2D articulated human shape,"MJ Black, O Freifeld, AW Weiss, MM Loper, P Guan","US Patent 11,062,528, 2021",,2021
Michael J. Black,Simulation and control of deformable autonomous airships in turbulent wind,"E Price, YT Liu, MJ Black, A Ahmad","International Conference on Intelligent Autonomous Systems, 608-626, 2021",7,2021
Michael J. Black,hSMAL: Detailed horse shape and pose reconstruction for motion pattern recognition,"C Li, N Ghorbani, S Broomé, M Rashid, MJ Black, E Hernlund, ...","arXiv preprint arXiv:2106.10102, 2021",12,2021
Michael J. Black,"Red shape, blue shape: political ideology influences the social perception of body shape","MA Quirós-Ramírez, S Streuber, MJ Black","Humanities and Social Sciences Communications 8 (1), 1-10, 2021",2,2021
Michael J. Black,Skinned multi-person linear model,"MJ Black, M Loper, N Mahmood, PM Gerard, J Romero","US Patent 11,017,577, 2021",,2021
Michael J. Black,"Body image disturbances and weight bias after obesity surgery: Semantic and visual evaluation in a controlled study, findings from the BodyTalk Project","P Meneguzzo, SC Behrens, A Favaro, E Tenconi, V Vindigni, M Teufel, ...","Obesity Surgery 31, 1625-1634, 2021",15,2021
Michael J. Black,Weight bias and linguistic body representation in anorexia nervosa: Findings from the BodyTalk project,"SC Behrens, P Meneguzzo, A Favaro, M Teufel, EM Skoda, M Lindner, ...","European Eating Disorders Review 29 (2), 204-215, 2021",25,2021
Michael J. Black,Körper-Sprache: Sprachliche Repräsentation von Körpern bei Patientinnen und Patienten mit Essstörungen,L Walder,"Universität Tübingen, 2021",,2021
Michael J. Black,"Red Shape, Blue Shape","MA Quirós-Ramírez, S Streuber, MJ Black",,,2021
Michael J. Black,"Black, and Gül Varol","M Petrovich, J Michael","Actionconditioned 3d human motion synthesis with transformer vae 2, 2021",22,2021
Michael J. Black,SPEC: Seeing people in the wild with an estimated camera,"M Kocabas, CHP Huang, J Tesch, L Müller, O Hilliges, MJ Black","Proceedings of the IEEE/CVF International Conference on Computer Vision …, 2021",87,2021
Michael J. Black,"Learning realistic human reposing using cyclic self-supervision with 3d shape, pose, and appearance consistency","S Sanyal, A Vorobiov, T Bolkart, M Loper, B Mohler, LS Davis, J Romero, ...","Proceedings of the IEEE/CVF International Conference on Computer Vision …, 2021",15,2021
Michael J. Black,Learning to regress bodies from images using differentiable semantic rendering,"SK Dwivedi, N Athanasiou, M Kocabas, MJ Black","Proceedings of the IEEE/CVF International Conference on Computer Vision …, 2021",35,2021
Michael J. Black,Soma: Solving optical marker-based mocap automatically,"N Ghorbani, MJ Black","Proceedings of the IEEE/CVF International Conference on Computer Vision …, 2021",17,2021
Michael J. Black,The power of points for modeling humans in clothing,"Q Ma, J Yang, S Tang, MJ Black","Proceedings of the IEEE/CVF International Conference on Computer Vision …, 2021",63,2021
Michael J. Black,Stochastic scene-aware motion prediction,"M Hassan, D Ceylan, R Villegas, J Saito, J Yang, Y Zhou, MJ Black","Proceedings of the IEEE/CVF International Conference on Computer Vision …, 2021",77,2021
Michael J. Black,"BABEL: Bodies, action and behavior with english labels","AR Punnakkal, A Chandrasekaran, N Athanasiou, A Quiros-Ramirez, ...","Proceedings of the IEEE/CVF Conference on Computer Vision and Pattern …, 2021",94,2021
Michael J. Black,AGORA: Avatars in geography optimized for regression analysis,"P Patel, CHP Huang, J Tesch, DT Hoffmann, S Tripathi, MJ Black","Proceedings of the IEEE/CVF Conference on Computer Vision and Pattern …, 2021",131,2021
Michael J. Black,"Monocular, one-stage, regression of multiple 3d people","Y Sun, Q Bao, W Liu, Y Fu, MJ Black, T Mei","Proceedings of the IEEE/CVF international conference on computer vision …, 2021",169,2021
Michael J. Black,PARE: Part attention regressor for 3D human body estimation,"M Kocabas, CHP Huang, O Hilliges, MJ Black","Proceedings of the IEEE/CVF International Conference on Computer Vision …, 2021",261,2021
Michael J. Black,LEAP: Learning articulated occupancy of people,"M Mihajlovic, Y Zhang, MJ Black, S Tang","Proceedings of the IEEE/CVF Conference on Computer Vision and Pattern …, 2021",98,2021
Michael J. Black,Action-conditioned 3D human motion synthesis with transformer VAE,"M Petrovich, MJ Black, G Varol","Proceedings of the IEEE/CVF International Conference on Computer Vision …, 2021",247,2021
Michael J. Black,SCANimate: Weakly supervised learning of skinned clothed avatar networks,"S Saito, J Yang, Q Ma, MJ Black","Proceedings of the IEEE/CVF Conference on Computer Vision and Pattern …, 2021",174,2021
Michael J. Black,On self-contact and human pose,"L Muller, AAA Osman, S Tang, CHP Huang, MJ Black","Proceedings of the IEEE/CVF Conference on Computer Vision and Pattern …, 2021",71,2021
Michael J. Black,Snarf: Differentiable forward skinning for animating non-rigid neural implicit shapes,"X Chen, Y Zheng, MJ Black, O Hilliges, A Geiger","Proceedings of the IEEE/CVF International Conference on Computer Vision …, 2021",153,2021
Michael J. Black,SCALE: Modeling clothed humans with a surface codec of articulated local elements,"Q Ma, S Saito, J Yang, S Tang, MJ Black","Proceedings of the IEEE/CVF Conference on Computer Vision and Pattern …, 2021",75,2021
Michael J. Black,Populating 3D scenes by learning human-scene interaction,"M Hassan, P Ghosh, J Tesch, D Tzionas, MJ Black","Proceedings of the IEEE/CVF Conference on Computer Vision and Pattern …, 2021",88,2021
Michael J. Black,2020 Index IEEE Transactions on Pattern Analysis and Machine Intelligence Vol. 42,"A Aberdam, J Achterhold, JK Adams, E Adeli, S Agaian, K Aizawa, ...","IEEE Transactions on Pattern Analysis and Machine Intelligence 43 (1), 2021",,2021
Michael J. Black,We are more than our joints: Predicting how 3d bodies move,"Y Zhang, MJ Black, S Tang","Proceedings of the IEEE/CVF Conference on Computer Vision and Pattern …, 2021",88,2021
Michael J. Black,Smplpix: Neural avatars from 3d human models,"S Prokudin, MJ Black, J Romero","Proceedings of the IEEE/CVF Winter Conference on Applications of Computer …, 2021",68,2021
Michael J. Black,PLACE: Proximity learning of articulation and contact in 3D environments,"S Zhang, Y Zhang, Q Ma, MJ Black, S Tang","2020 International Conference on 3D Vision (3DV), 642-651, 2020",75,2020
Michael J. Black,Gif: Generative interpretable faces,"P Ghosh, PS Gupta, R Uziel, A Ranjan, MJ Black, T Bolkart","2020 International Conference on 3D Vision (3DV), 868-878, 2020",54,2020
Michael J. Black,Grasping field: Learning implicit representations for human grasps,"K Karunratanakul, J Yang, Y Zhang, MJ Black, K Muandet, S Tang","2020 International Conference on 3D Vision (3DV), 333-344, 2020",146,2020
Michael J. Black,Occlusion boundary: A formal definition & its detection via deep exploration of context,"C Wang, H Fu, D Tao, MJ Black","IEEE Transactions on Pattern Analysis and Machine Intelligence 44 (5), 2641-2656, 2020",3,2020
Michael J. Black,Crowdshaping realistic 3D avatars with words,"S Streuber, MAQ RAMÍREZ, M Black, S Zuffi, A O'toole","US Patent 10,818,062, 2020",4,2020
Michael J. Black,The Role of Sexual Dimorphism in the Perception of Attractiveness and Confidence,"A Thaler, A Bieg, N Mahmood, MJ Black, BJ Mohler, NF Troje","Journal of Vision 20 (11), 878-878, 2020",1,2020
Michael J. Black,Co-registration—simultaneous alignment and modeling of articulated 3D shapes,"M Black, DL Hirshberg, M Loper, E Rachlin, A Weiss","US Patent 10,755,464, 2020",,2020
