author_name,title,authors,publication,cited_by_value,year
Michael J. Black,Scalable robust principal component analysis using grassmann averages,"S Hauberg, A Feragen, R Enficiaud, MJ Black","IEEE transactions on pattern analysis and machine intelligence 38 (11), 2298 …, 2015",38,2015
Michael J. Black,Method and apparatus for estimating body shape,"MJ Black, AO Balan, AW Weiss, MM Loper, TSS Clair","US Patent 9,189,886, 2015",533,2015
Michael J. Black,Towards probabilistic volumetric reconstruction using ray potentials,"AO Ulusoy, A Geiger, MJ Black","2015 International Conference on 3D Vision, 10-18, 2015",72,2015
Michael J. Black,Dataset Suite for Benchmarking Perception in Robotics,"A Ahmad, P Lima","IROS 2015 Workshop: Open Forum on Evaluation of Results, Replication of …, 2015",,2015
Michael J. Black,Perception of strength and power of realistic male characters,"AC Wellerdiek, M Breidt, MN Geuss, S Streuber, U Kloos, MJ Black, ...","Proceedings of the ACM SIGGRAPH Symposium on Applied Perception, 7-14, 2015",12,2015
Michael J. Black,Exploring the relationship between body shapes and descriptions by linking similarity spaces,"M Hill, S Streuber, C Hahn, M Black, A O'Toole","Journal of Vision 15 (12), 931-931, 2015",5,2015
Michael J. Black,Linking objects to actions: encoding of target object and grasping strategy in primate ventral premotor cortex,"CE Vargas-Irwin, L Franquemont, MJ Black, JP Donoghue","Journal of Neuroscience 35 (30), 10888-10897, 2015",49,2015
Michael J. Black,Dyna: A model of dynamic human shape in motion,"G Pons-Moll, J Romero, N Mahmood, MJ Black","ACM Transactions on Graphics (TOG) 34 (4), 1-14, 2015",360,2015
Michael J. Black,Human pose calculation from optical flow data,"MJ Black, M Loper, J Romero, S Zuffi",,,2015
Michael J. Black,Intrinsic depth: Improving depth transfer with intrinsic images,"N Kong, MJ Black","Proceedings of the IEEE International Conference on Computer Vision, 3514-3522, 2015",50,2015
Michael J. Black,FlowCap: 2D human pose from optical flow,"J Romero, M Loper, MJ Black","Pattern Recognition: 37th German Conference, GCPR 2015, Aachen, Germany …, 2015",26,2015
Michael J. Black,Detailed full-body reconstructions of moving people from monocular RGB-D sequences,"F Bogo, MJ Black, M Loper, J Romero","Proceedings of the IEEE international conference on computer vision, 2300-2308, 2015",233,2015
Michael J. Black,Efficient sparse-to-dense optical flow estimation using a learned basis and layers,"J Wulff, MJ Black","Proceedings of the IEEE Conference on Computer Vision and Pattern …, 2015",191,2015
Michael J. Black,The stitched puppet: A graphical model of 3d human shape and pose,"S Zuffi, MJ Black","Proceedings of the IEEE Conference on Computer Vision and Pattern …, 2015",160,2015
Michael J. Black,Pose-conditioned joint angle limits for 3D human pose reconstruction,"I Akhter, MJ Black","Proceedings of the IEEE conference on computer vision and pattern …, 2015",447,2015
Michael J. Black,Spike train SIMilarity Space (SSIMS): a framework for single neuron and ensemble data analysis,"CE Vargas-Irwin, DM Brandman, JB Zimmermann, JP Donoghue, ...","Neural computation 27 (1), 1-31, 2015",36,2015
